{
  "catalogVersion" : "1.1.0",
  "defaultPetID" : "dingdang",
  "pets" : [
    {
      "animations" : {
        "failed" : {
          "frames" : [
            {
              "atlas" : "main",
              "column" : 0,
              "durationMs" : 140,
              "row" : 5
            },
            {
              "atlas" : "main",
              "column" : 1,
              "durationMs" : 140,
              "row" : 5
            },
            {
              "atlas" : "main",
              "column" : 2,
              "durationMs" : 140,
              "row" : 5
            },
            {
              "atlas" : "main",
              "column" : 3,
              "durationMs" : 140,
              "row" : 5
            },
            {
              "atlas" : "main",
              "column" : 4,
              "durationMs" : 140,
              "row" : 5
            },
            {
              "atlas" : "main",
              "column" : 5,
              "durationMs" : 140,
              "row" : 5
            },
            {
              "atlas" : "main",
              "column" : 6,
              "durationMs" : 140,
              "row" : 5
            },
            {
              "atlas" : "main",
              "column" : 7,
              "durationMs" : 240,
              "row" : 5
            }
          ],
          "loop" : false
        },
        "idle" : {
          "frames" : [
            {
              "atlas" : "main",
              "column" : 0,
              "durationMs" : 280,
              "row" : 0
            },
            {
              "atlas" : "main",
              "column" : 1,
              "durationMs" : 110,
              "row" : 0
            },
            {
              "atlas" : "main",
              "column" : 2,
              "durationMs" : 110,
              "row" : 0
            },
            {
              "atlas" : "main",
              "column" : 3,
              "durationMs" : 140,
              "row" : 0
            },
            {
              "atlas" : "main",
              "column" : 4,
              "durationMs" : 140,
              "row" : 0
            },
            {
              "atlas" : "main",
              "column" : 5,
              "durationMs" : 320,
              "row" : 0
            }
          ],
          "loop" : true
        },
        "jumping" : {
          "frames" : [
            {
              "atlas" : "main",
              "column" : 0,
              "durationMs" : 140,
              "row" : 4
            },
            {
              "atlas" : "main",
              "column" : 1,
              "durationMs" : 140,
              "row" : 4
            },
            {
              "atlas" : "main",
              "column" : 2,
              "durationMs" : 140,
              "row" : 4
            },
            {
              "atlas" : "main",
              "column" : 3,
              "durationMs" : 140,
              "row" : 4
            },
            {
              "atlas" : "main",
              "column" : 4,
              "durationMs" : 280,
              "row" : 4
            }
          ],
          "loop" : false
        },
        "look-000" : {
          "frames" : [
            {
              "atlas" : "main",
              "column" : 0,
              "row" : 9
            }
          ],
          "loop" : true
        },
        "look-1125" : {
          "frames" : [
            {
              "atlas" : "main",
              "column" : 5,
              "row" : 9
            }
          ],
          "loop" : true
        },
        "look-1350" : {
          "frames" : [
            {
              "atlas" : "main",
              "column" : 6,
              "row" : 9
            }
          ],
          "loop" : true
        },
        "look-1575" : {
          "frames" : [
            {
              "atlas" : "main",
              "column" : 7,
              "row" : 9
            }
          ],
          "loop" : true
        },
        "look-1800" : {
          "frames" : [
            {
              "atlas" : "main",
              "column" : 0,
              "row" : 10
            }
          ],
          "loop" : true
        },
        "look-2025" : {
          "frames" : [
            {
              "atlas" : "main",
              "column" : 1,
              "row" : 10
            }
          ],
          "loop" : true
        },
        "look-225" : {
          "frames" : [
            {
              "atlas" : "main",
              "column" : 1,
              "row" : 9
            }
          ],
          "loop" : true
        },
        "look-2250" : {
          "frames" : [
            {
              "atlas" : "main",
              "column" : 2,
              "row" : 10
            }
          ],
          "loop" : true
        },
        "look-2475" : {
          "frames" : [
            {
              "atlas" : "main",
              "column" : 3,
              "row" : 10
            }
          ],
          "loop" : true
        },
        "look-2700" : {
          "frames" : [
            {
              "atlas" : "main",
              "column" : 4,
              "row" : 10
            }
          ],
          "loop" : true
        },
        "look-2925" : {
          "frames" : [
            {
              "atlas" : "main",
              "column" : 5,
              "row" : 10
            }
          ],
          "loop" : true
        },
        "look-3150" : {
          "frames" : [
            {
              "atlas" : "main",
              "column" : 6,
              "row" : 10
            }
          ],
          "loop" : true
        },
        "look-3375" : {
          "frames" : [
            {
              "atlas" : "main",
              "column" : 7,
              "row" : 10
            }
          ],
          "loop" : true
        },
        "look-450" : {
          "frames" : [
            {
              "atlas" : "main",
              "column" : 2,
              "row" : 9
            }
          ],
          "loop" : true
        },
        "look-675" : {
          "frames" : [
            {
              "atlas" : "main",
              "column" : 3,
              "row" : 9
            }
          ],
          "loop" : true
        },
        "look-900" : {
          "frames" : [
            {
              "atlas" : "main",
              "column" : 4,
              "row" : 9
            }
          ],
          "loop" : true
        },
        "review" : {
          "frames" : [
            {
              "atlas" : "main",
              "column" : 0,
              "durationMs" : 150,
              "row" : 8
            },
            {
              "atlas" : "main",
              "column" : 1,
              "durationMs" : 150,
              "row" : 8
            },
            {
              "atlas" : "main",
              "column" : 2,
              "durationMs" : 150,
              "row" : 8
            },
            {
              "atlas" : "main",
              "column" : 3,
              "durationMs" : 150,
              "row" : 8
            },
            {
              "atlas" : "main",
              "column" : 4,
              "durationMs" : 150,
              "row" : 8
            },
            {
              "atlas" : "main",
              "column" : 5,
              "durationMs" : 280,
              "row" : 8
            }
          ],
          "loop" : true
        },
        "running" : {
          "frames" : [
            {
              "atlas" : "main",
              "column" : 0,
              "durationMs" : 120,
              "row" : 7
            },
            {
              "atlas" : "main",
              "column" : 1,
              "durationMs" : 120,
              "row" : 7
            },
            {
              "atlas" : "main",
              "column" : 2,
              "durationMs" : 120,
              "row" : 7
            },
            {
              "atlas" : "main",
              "column" : 3,
              "durationMs" : 120,
              "row" : 7
            },
            {
              "atlas" : "main",
              "column" : 4,
              "durationMs" : 120,
              "row" : 7
            },
            {
              "atlas" : "main",
              "column" : 5,
              "durationMs" : 220,
              "row" : 7
            }
          ],
          "loop" : true
        },
        "running-left" : {
          "frames" : [
            {
              "atlas" : "main",
              "column" : 0,
              "durationMs" : 120,
              "row" : 2
            },
            {
              "atlas" : "main",
              "column" : 1,
              "durationMs" : 120,
              "row" : 2
            },
            {
              "atlas" : "main",
              "column" : 2,
              "durationMs" : 120,
              "row" : 2
            },
            {
              "atlas" : "main",
              "column" : 3,
              "durationMs" : 120,
              "row" : 2
            },
            {
              "atlas" : "main",
              "column" : 4,
              "durationMs" : 120,
              "row" : 2
            },
            {
              "atlas" : "main",
              "column" : 5,
              "durationMs" : 120,
              "row" : 2
            },
            {
              "atlas" : "main",
              "column" : 6,
              "durationMs" : 120,
              "row" : 2
            },
            {
              "atlas" : "main",
              "column" : 7,
              "durationMs" : 220,
              "row" : 2
            }
          ],
          "loop" : true
        },
        "running-right" : {
          "frames" : [
            {
              "atlas" : "main",
              "column" : 0,
              "durationMs" : 120,
              "row" : 1
            },
            {
              "atlas" : "main",
              "column" : 1,